<?xml version="1.0"?>
<DATATYPES xmlns:xsi="http://www.w3.org/2001/XMLSchema-instance"
           xsi:schemaLocation="pl.poznan.put.sqldatagenerator ../datatypeSchema.xsd"
           xmlns="pl.poznan.put.sqldatagenerator">

    <DATATYPE>
        <NAME>VARCHAR</NAME>
        <BASETYPE>VARCHAR</BASETYPE>
        <MIN_VALUE>1</MIN_VALUE>
        <MAX_VALUE>64000</MAX_VALUE>
    </DATATYPE>

    <DATATYPE>
        <NAME>CHAR</NAME>
        <ALIAS_FOR>VARCHAR</ALIAS_FOR>
    </DATATYPE>

    <DATATYPE>
        <NAME>CHARACTER</NAME>
        <ALIAS_FOR>VARCHAR</ALIAS_FOR>
    </DATATYPE>

    <DATATYPE>
        <NAME>CHARACTER VARYING</NAME>
        <ALIAS_FOR>VARCHAR</ALIAS_FOR>
    </DATATYPE>

    <DATATYPE>
        <NAME>CHAR VARYING</NAME>
        <ALIAS_FOR>VARCHAR</ALIAS_FOR>
    </DATATYPE>


    <DATATYPE>
        <NAME>DATETIME</NAME>
        <BASETYPE>DATETIME</BASETYPE>
        <MIN_VALUE>1900-01-01 00:00:00</MIN_VALUE>
        <MAX_VALUE>2100-12-31 23:59:59</MAX_VALUE>
    </DATATYPE>

    <DATATYPE>
        <NAME>TIMESTAMP</NAME>
        <ALIAS_FOR>DATETIME</ALIAS_FOR>
    </DATATYPE>


    <DATATYPE>
        <NAME>FLOAT</NAME>
        <BASETYPE>FLOAT</BASETYPE>
        <MIN_VALUE>-2147483648</MIN_VALUE>
        <MAX_VALUE>2147483647</MAX_VALUE>
    </DATATYPE>

    <DATATYPE>
        <NAME>REAL</NAME>
        <ALIAS_FOR>FLOAT</ALIAS_FOR>
    </DATATYPE>

    <DATATYPE>
        <NAME>DOUBLE PRECISION</NAME>
        <ALIAS_FOR>FLOAT</ALIAS_FOR>
    </DATATYPE>

    <DATATYPE>
        <NAME>DOUBLE</NAME>
        <ALIAS_FOR>FLOAT</ALIAS_FOR>
    </DATATYPE>


    <DATATYPE>
        <NAME>INTEGER</NAME>
        <BASETYPE>INTEGER</BASETYPE>
        <MIN_VALUE>-2147483648</MIN_VALUE>
        <MAX_VALUE>2147483647</MAX_VALUE>
    </DATATYPE>

    <DATATYPE>
        <NAME>INT</NAME>
        <ALIAS_FOR>INTEGER</ALIAS_FOR>
    </DATATYPE>

    <DATATYPE>
        <NAME>INT4</NAME>
        <ALIAS_FOR>INTEGER</ALIAS_FOR>
    </DATATYPE>


    <DATATYPE>
        <NAME>BYTEINT</NAME>
        <BASETYPE>INTEGER</BASETYPE>
        <MIN_VALUE>-128</MIN_VALUE>
        <MAX_VALUE>127</MAX_VALUE>
    </DATATYPE>

    <DATATYPE>
        <NAME>INT1</NAME>
        <ALIAS_FOR>BYTEINT</ALIAS_FOR>
    </DATATYPE>


    <DATATYPE>
        <NAME>SMALLINT</NAME>
        <BASETYPE>INTEGER</BASETYPE>
        <MIN_VALUE>â€“32768</MIN_VALUE>
        <MAX_VALUE>32767</MAX_VALUE>
    </DATATYPE>

    <DATATYPE>
        <NAME>INT2</NAME>
        <ALIAS_FOR>SMALLINT</ALIAS_FOR>
    </DATATYPE>


    <DATATYPE>
        <NAME>BIGINT</NAME>
        <BASETYPE>INTEGER</BASETYPE>
        <MIN_VALUE>-9223372036854775808</MIN_VALUE>
        <MAX_VALUE>9223372036854775807</MAX_VALUE>
    </DATATYPE>

    <DATATYPE>
        <NAME>INT8</NAME>
        <ALIAS_FOR>BIGINT</ALIAS_FOR>
    </DATATYPE>
</DATATYPES>
